{"schema": "number-one-twib-inventory/v1", "source_id": "nomad:number-one", "episode": {"id": "episode_f95f48bf4eac4e84c7becec8aaac50c6cb732f301f170ab709f58a2c961b223b", "show": "twib", "number": 128}, "snapshot": {"mode": "full", "complete": true, "allow_deletions": false, "scope": "episode_media_and_allowlisted_local_artifacts", "consistency": "metadata_double_scan_not_atomic", "candidate_coverage": "partial"}, "coverage": [{"artifact": "transcripts/bookmark-narrative-brief.json", "status": "absent"}, {"artifact": "transcripts/manual-clip-layout.json", "status": "absent"}, {"artifact": "transcripts/prep-manifest.json", "status": "absent"}, {"artifact": "transcripts/safe-intake-supporting-links.json", "status": "absent"}, {"artifact": "transcripts/source-watch.json", "status": "absent"}, {"artifact": "transcripts/supporting-clip-candidates.json", "status": "absent"}], "items": [{"id": "item_870ddfcc2d7104039d4f1779d566ec78695f54e2ececec82739be55a438a063d", "kind": "media", "media": {"ref": "edit.mp4", "present": true, "size_bytes": 21, "modified_at": "2026-10-19T14:33:31.592703Z", "duration_seconds": null}, "observations": [], "origins": [], "producer_record": {"clip_id": "edit-id", "record_kind": "processing-history", "first_seen_at": null, "source_signature": null, "parent_clip_id": "source-id", "manual_derivative": {"parent_clip_id": "source-id", "source_sha256": "5e48091d2f35cff6fce61f943af0d51cbb6dd6c017ec8d7eba194a6e54565c2a", "derivative_sha256": "bb8b281a8e2d9703eb0d4291bf76b8c329e44b4dadbfabcf2f4705b3b08a2c97", "source_in_seconds": 85.4, "source_out_seconds": 162.4, "source_duration_seconds": 168.576871, "verification": "local-sha256"}}, "processing_status": "unverified", "ready": false}, {"id": "item_d2d2e0757f8ed9e82508a1769b144a223331b830b592aaa20408679e59872a8e", "kind": "media", "media": {"ref": "source.mp4", "present": true, "size_bytes": 25, "modified_at": "2026-10-19T14:33:31.592635Z", "duration_seconds": null}, "observations": [], "origins": [], "producer_record": {"clip_id": "source-id", "record_kind": "processing-history", "first_seen_at": null, "source_signature": null, "parent_clip_id": null}, "processing_status": "unverified", "ready": false}], "warnings": ["local_artifacts_only_no_provider_polling", "native_history_projection_scoped", "not_atomic_deletions_disabled", "readiness_not_evaluated"], "idempotency_digest": "sha256:e2d449978bc0c582749609263fd0423703cee2aa17108830b7dc1fd99e306436", "observed_at": "2026-10-19T14:33:31.592960Z", "scan_finished_at": "2026-10-19T14:33:31.595425Z"}